Name	title	coding
t3_17rsbn2	Rate concordia's mental health programs
t3_17qu8b1	THEO 204 Question
t3_17qddjg	Is it fine to wear a hat or a cap during exams?
t3_17ss3m8	Is the computer lab open or accesbible during the weekend?
t3_17tma1e	Gina Cody School Course Offerings for Exchange Students
t3_17sg4io	CSU Fall By-Election Results are in
t3_17rfuk7	Exercise science students at Loyola
t3_17r247t	Trending on Twitter for all the wrong reasons
t3_17rhkhh	CIBC ASG Analyst Interview
t3_17scpim	COMP248- Dr. Molokwu
t3_17runw8	Do you guys think I’ll get into jmsb with a 2.67 gpa?
t3_17rf83r	Statement from the accused.
t3_17tlias	Where to buy Mate Libres on campus or close to campus?
t3_17siidt	extra assignment for bonus points
t3_17skmmx	How to see required classes?
t3_17qarvu	Please READ ME!
t3_17r00q0	So many protests and strikes
t3_17rmhcn	Mana courses
t3_17rieql	UdeM Professor Yanise Arab yells at a Jewish student in Concordia to “go back to Poland, sharmouta (wh*re)”
t3_17t27ej	Poster Sale
t3_17tt2jq	Looking for calligraphy clubs
t3_17q9627	COMM 217
t3_17q0iyj	CAQ Taking more than 25 working days
t3_17riyfg	Philosophy 201
t3_17qin7h	What if universities don’t comply with tuition hikes?
t3_17rik3r	Full time or part time
t3_17sldc7	Is it common for a prof to raise a midterm mark if I ask?
t3_17q50zj	As a MEP student who has just been accepted into the Arts &amp; Science Certificate with the Intentions of transferring into Computer Science, should I disregard the requirements to complete the cert?
t3_17rxzfh	sphrconu statement regarding November 8.
t3_17rsn36	Fee levy increase happening now
t3_17s55fu	How to accept offer of admission?
t3_17qoaxo	MATH 201 Midterm
t3_17sl2nh	AFE quebec student Loan repayment calculation
t3_17tmxen	Gradesavers
t3_17t2oi0	Thoughts on Phil 235 Biomedical Ethics?
t3_17pyjmz	Recreation facilities
t3_17qx956	Comm 305
t3_17q0y4b	How much credit to be full time during summer?
t3_17pz4p9	How hard is it to switch programs?
t3_17rgjpn	Fee levy opt outs
t3_17qv6mn	Police operation in Hall building after Pro-Palestinian protesters crash booth aimed at raising awareness for Israeli hostages 
t3_17q9lqk	Is the Kenneth Woods Portfolio Management only for year 1 students?
t3_17qb6sx	Going from udem to concordia, grades conversion
t3_17te0r9	Is there a Good Samaritan willing to sharing some Pearson exercises for comm 220? I don’t have the online access to Pearson for 220
t3_17semyi	Co-op
t3_17r7txt	International Student from US - Do I need a CAQ or study permit if I'm only going to be here for less than 6 months?
t3_17q1dbg	How can I get access to FactSet as a concordia finance student?
t3_17te2sk	Looking for a job
t3_17tskx8	Admission grade transfer student
t3_17raozi	1st term courses MEng Quality System Eng.
